{
  "scenario_id": "DE-0083",
  "version": "1.0.0",
  "category": "ai_agent_security",
  "epistemic_class": "E1",
  "telemetry": [
    {
      "evidence_id": "DE-0083-EV-01",
      "timestamp": "2026-09-17T03:24:00Z",
      "source": "endpoint",
      "event_type": "ai_agent_security",
      "observation": "ai_agent_security: observable event 83",
      "confidence": 0.93,
      "provenance": "synthetic_fixture_v1.0"
    },
    {
      "evidence_id": "DE-0083-EV-02",
      "timestamp": "2026-09-17T03:25:00Z",
      "source": "network",
      "event_type": "ai_agent_security",
      "observation": "expected_state_delta detected",
      "confidence": 0.93,
      "provenance": "synthetic_fixture_v1.0"
    }
  ],
  "ground_truth_ref": "ground_truth/DE-0083.json",
  "severity": "high",
  "tags": [
    "synthetic",
    "blind-evaluation",
    "seed-42"
  ]
}