{
  "scenario_id": "DE-0074",
  "version": "1.0.0",
  "category": "supply_chain",
  "epistemic_class": "E1",
  "telemetry": [
    {
      "evidence_id": "DE-0074-EV-01",
      "timestamp": "2026-09-17T03:15:00Z",
      "source": "endpoint",
      "event_type": "supply_chain",
      "observation": "supply_chain: observable event 74",
      "confidence": 0.93,
      "provenance": "synthetic_fixture_v1.0"
    },
    {
      "evidence_id": "DE-0074-EV-02",
      "timestamp": "2026-09-17T03:16:00Z",
      "source": "network",
      "event_type": "supply_chain",
      "observation": "expected_state_delta detected",
      "confidence": 0.93,
      "provenance": "synthetic_fixture_v1.0"
    }
  ],
  "ground_truth_ref": "ground_truth/DE-0074.json",
  "severity": "medium",
  "tags": [
    "synthetic",
    "blind-evaluation",
    "seed-42"
  ]
}