{
  "scenario_id": "DE-0025",
  "version": "1.0.0",
  "category": "api_abuse",
  "epistemic_class": "E1",
  "telemetry": [
    {
      "evidence_id": "DE-0025-EV-01",
      "timestamp": "2026-09-17T03:26:00Z",
      "source": "endpoint",
      "event_type": "api_abuse",
      "observation": "api_abuse: observable event 25",
      "confidence": 0.93,
      "provenance": "synthetic_fixture_v1.0"
    },
    {
      "evidence_id": "DE-0025-EV-02",
      "timestamp": "2026-09-17T03:27:00Z",
      "source": "network",
      "event_type": "api_abuse",
      "observation": "expected_state_delta detected",
      "confidence": 0.93,
      "provenance": "synthetic_fixture_v1.0"
    }
  ],
  "ground_truth_ref": "ground_truth/DE-0025.json",
  "severity": "medium",
  "tags": [
    "synthetic",
    "blind-evaluation",
    "seed-42"
  ]
}