{
  "scenario_id": "DE-0009",
  "version": "1.0.0",
  "category": "credential_anomaly",
  "epistemic_class": "E3",
  "telemetry": [
    {
      "evidence_id": "DE-0009-EV-01",
      "timestamp": "2026-09-17T03:10:00Z",
      "source": "endpoint",
      "event_type": "credential_anomaly",
      "observation": "credential_anomaly: observable event 9",
      "confidence": 0.44,
      "provenance": "synthetic_fixture_v1.0"
    },
    {
      "evidence_id": "DE-0009-EV-02",
      "timestamp": "2026-09-17T03:11:00Z",
      "source": "network",
      "event_type": "credential_anomaly",
      "observation": "expected_state_delta detected",
      "confidence": 0.44,
      "provenance": "synthetic_fixture_v1.0"
    },
    {
      "evidence_id": "DE-0009-EV-03",
      "timestamp": "2026-09-17T03:12:00Z",
      "source": "api_gateway",
      "event_type": "credential_anomaly",
      "observation": "insufficient corroboration",
      "confidence": 0.43,
      "provenance": "synthetic_fixture_v1.0"
    }
  ],
  "ground_truth_ref": "ground_truth/DE-0009.json",
  "severity": "medium",
  "tags": [
    "synthetic",
    "blind-evaluation",
    "seed-42"
  ]
}