{
  "scenario_id": "DE-0062",
  "version": "1.0.0",
  "category": "data_exfiltration",
  "epistemic_class": "E1",
  "telemetry": [
    {
      "evidence_id": "DE-0062-EV-01",
      "timestamp": "2026-09-17T03:03:00Z",
      "source": "endpoint",
      "event_type": "data_exfiltration",
      "observation": "data_exfiltration: observable event 62",
      "confidence": 0.93,
      "provenance": "synthetic_fixture_v1.0"
    },
    {
      "evidence_id": "DE-0062-EV-02",
      "timestamp": "2026-09-17T03:04:00Z",
      "source": "network",
      "event_type": "data_exfiltration",
      "observation": "expected_state_delta detected",
      "confidence": 0.93,
      "provenance": "synthetic_fixture_v1.0"
    }
  ],
  "ground_truth_ref": "ground_truth/DE-0062.json",
  "severity": "high",
  "tags": [
    "synthetic",
    "blind-evaluation",
    "seed-42"
  ]
}