{
  "scenario_id": "DE-0016",
  "version": "1.0.0",
  "category": "identity_privilege",
  "epistemic_class": "E1",
  "telemetry": [
    {
      "evidence_id": "DE-0016-EV-01",
      "timestamp": "2026-09-17T03:17:00Z",
      "source": "endpoint",
      "event_type": "identity_privilege",
      "observation": "identity_privilege: observable event 16",
      "confidence": 0.93,
      "provenance": "synthetic_fixture_v1.0"
    },
    {
      "evidence_id": "DE-0016-EV-02",
      "timestamp": "2026-09-17T03:18:00Z",
      "source": "network",
      "event_type": "identity_privilege",
      "observation": "expected_state_delta detected",
      "confidence": 0.93,
      "provenance": "synthetic_fixture_v1.0"
    }
  ],
  "ground_truth_ref": "ground_truth/DE-0016.json",
  "severity": "high",
  "tags": [
    "synthetic",
    "blind-evaluation",
    "seed-42"
  ]
}