{
  "scenario_id": "DE-0051",
  "version": "1.0.0",
  "category": "network_anomaly",
  "epistemic_class": "E1",
  "telemetry": [
    {
      "evidence_id": "DE-0051-EV-01",
      "timestamp": "2026-09-17T03:52:00Z",
      "source": "endpoint",
      "event_type": "network_anomaly",
      "observation": "network_anomaly: observable event 51",
      "confidence": 0.93,
      "provenance": "synthetic_fixture_v1.0"
    },
    {
      "evidence_id": "DE-0051-EV-02",
      "timestamp": "2026-09-17T03:53:00Z",
      "source": "network",
      "event_type": "network_anomaly",
      "observation": "expected_state_delta detected",
      "confidence": 0.93,
      "provenance": "synthetic_fixture_v1.0"
    }
  ],
  "ground_truth_ref": "ground_truth/DE-0051.json",
  "severity": "medium",
  "tags": [
    "synthetic",
    "blind-evaluation",
    "seed-42"
  ]
}